{
  "schema_version": 1,
  "id": "constitution.1-0-0",
  "record_version": "1.0.0",
  "constitution_version": "1.0.0",
  "status": "effective",
  "work_order_id": "work-009",
  "commit": "ac2f00def074e5bee7c50753e9bc9af82b655bd2",
  "effective_at": "2026-08-06T17:12:00+02:00",
  "amendment_level": "E3",
  "document_path": "governance/CONSTITUTION.md"
}
